runtime_role,asset,habitat,instances,baseline_score,baseline_failure,candidate_status
baby rosette,assets/sky_lagoon/lagoon_kit/lagoon_baby_rosette.glb,meadow,varies,3.0,"complete but weak planted transition",pending final Mobile 4.5 gate
meadow shrub,assets/sky_lagoon/lagoon_kit/lagoon_meadow_shrub.glb,meadow,varies,3.0,"complete but palette and base lacked family finish",pending final Mobile 4.5 gate
coral flowers,assets/sky_lagoon/lagoon_kit/lagoon_flower_cluster_coral.glb,meadow,varies,3.0,"complete cluster but generic presentation",pending final Mobile 4.5 gate
lavender flowers,assets/sky_lagoon/lagoon_kit/lagoon_flower_cluster_lavender.glb,meadow,varies,3.0,"complete cluster but generic presentation",pending final Mobile 4.5 gate
mushroom cluster,assets/sky_lagoon/lagoon_kit/lagoon_mushroom_cluster.glb,meadow,varies,3.0,"complete cluster but unrelated imported family",pending final Mobile 4.5 gate
pond reeds,assets/sky_lagoon/lagoon_kit/lagoon_pond_reeds.glb,water edge,10,3.0,"rooting and family palette weak in night evidence",pending final Mobile 4.5 gate
river stones,assets/sky_lagoon/lagoon_kit/lagoon_river_stones.glb,river bank,12,3.0,"small generic bank accents",pending final Mobile 4.5 gate
original rounded pine,assets/props/gen2/tree_pineroundf.glb,meadow and snow,varies,4.6,"approved original GEN2 anchor retained unchanged","accepted anchor 4.6; pending final Mobile scene gate"
original autumn oak,assets/props/gen2/tree_fall.glb,meadow,varies,4.8,"approved original GEN2 anchor retained unchanged","accepted anchor 4.8; pending final Mobile scene gate"
original airy fall tree,assets/props/gen2/tree_fall2.glb,meadow,varies,4.7,"approved original GEN2 anchor retained unchanged","accepted anchor 4.7; pending final Mobile scene gate"
original round-canopy tree,assets/props/gen2/tree_fat.glb,meadow,varies,4.6,"approved original GEN2 anchor retained unchanged","accepted anchor 4.6; pending final Mobile scene gate"
ancient hollow oak,assets/sky_lagoon/lagoon_kit/lagoon_tree_ancient_oak.glb,meadow,1+groves,1.5,"role absent; rejected procedural trials looked assembled","accepted isolated turntable 4.6; 16529 triangles; pending final Mobile scene gate"
dancing birch,assets/sky_lagoon/lagoon_kit/lagoon_tree_dancing_birch.glb,meadow,1+groves,1.5,"role absent; rejected procedural trial lacked original GEN2 finish","accepted isolated turntable 4.6; 2110 triangles; pending final Mobile scene gate"
umbrella tree,assets/sky_lagoon/lagoon_kit/lagoon_tree_umbrella.glb,meadow,1+groves,1.5,"role absent; rejected procedural trial used a repeated crown","accepted isolated turntable 4.5; 4034 triangles; pending final Mobile scene gate"
blossom cloud tree,assets/sky_lagoon/lagoon_kit/lagoon_tree_blossom_cloud.glb,meadow,1+groves,1.5,"role absent; first gen3 accent pass collapsed under toon outline","accepted regenerated isolated turntable 4.5; 4356 triangles; pending final Mobile scene gate"
windswept tree,assets/sky_lagoon/lagoon_kit/lagoon_tree_windswept.glb,meadow,1+groves,1.5,"role absent; rejected procedural trial lacked structural depth","accepted isolated turntable 4.6; 3636 triangles; pending final Mobile scene gate"
twin-trunk heart orchard,assets/sky_lagoon/lagoon_kit/lagoon_tree_twinheart.glb,meadow,1+groves,1.5,"role absent; first gen3 fruit pass collapsed under toon outline","accepted regenerated isolated turntable 4.6; 4354 triangles; pending final Mobile scene gate"
weeping willow,assets/sky_lagoon/lagoon_kit/lagoon_tree_weeping_willow.glb,pond edge,2,1.5,"role absent; rejected procedural curtains read as bowls","accepted isolated turntable 4.6; 5484 triangles; pending final Mobile scene gate"
celebration snow pine,assets/sky_lagoon/lagoon_kit/lagoon_tree_celebration_snow.glb,snow,1,2.0,"procedural cone stack and small accents collapsed under outline","accepted regenerated isolated turntable 4.7; 2782 triangles; pending final Mobile scene gate"
story lantern,assets/sky_lagoon/lagoon_kit/lagoon_story_lantern.glb,path,6,3.0,"existing authored role lacked whole-kit cohesion",pending final Mobile 4.5 gate
memory frame,assets/sky_lagoon/lagoon_kit/lagoon_memory_frame.glb,path,6,3.0,"existing surround did not match rebuilt focal architecture",pending final Mobile 4.5 gate
rainbow race arch,assets/sky_lagoon/lagoon_kit/lagoon_rainbow_race_arch.glb,meadow route,2,2.5,"thin hoop silhouette",pending final Mobile 4.5 gate
butterfly world gate,assets/sky_lagoon/lagoon_kit/lagoon_butterfly_world_gate.glb,meadow portal,1,2.0,"thin wire/hoop gate language",pending final Mobile 4.5 gate
entry gatehouse,assets/sky_lagoon/lagoon_kit/lagoon_entry_gatehouse.glb,path,1,2.0,"mixed stock towers walls and flags",pending final Mobile 4.5 gate
park bench,assets/sky_lagoon/lagoon_kit/lagoon_park_bench.glb,park,3,2.0,"unrelated stock park kit",pending final Mobile 4.5 gate
park hedge,assets/sky_lagoon/lagoon_kit/lagoon_park_hedge.glb,park,6,2.0,"unrelated stock park kit",pending final Mobile 4.5 gate
park fountain,assets/sky_lagoon/lagoon_kit/lagoon_park_fountain.glb,park,1,2.0,"unrelated stock park kit",pending final Mobile 4.5 gate
play slide,assets/sky_lagoon/lagoon_kit/lagoon_play_slide.glb,playground,1,2.0,"mixed external toy palette and edge language",pending final Mobile 4.5 gate
play swing,assets/sky_lagoon/lagoon_kit/lagoon_play_swing.glb,playground,1,2.0,"mixed external toy palette and edge language",pending final Mobile 4.5 gate
play seesaw,assets/sky_lagoon/lagoon_kit/lagoon_play_seesaw.glb,playground,1,2.0,"mixed external toy palette and edge language",pending final Mobile 4.5 gate
play merry-go-round,assets/sky_lagoon/lagoon_kit/lagoon_play_merry.glb,playground,1,2.0,"mixed external toy palette and edge language",pending final Mobile 4.5 gate
play sandbox,assets/sky_lagoon/lagoon_kit/lagoon_play_sandbox.glb,playground,1,2.0,"mixed external toy palette and edge language",pending final Mobile 4.5 gate
play spring horse,assets/sky_lagoon/lagoon_kit/lagoon_play_spring_horse.glb,playground,1,2.0,"mixed external toy palette and edge language",pending final Mobile 4.5 gate
train station,assets/sky_lagoon/lagoon_kit/lagoon_train_station.glb,railway,1,2.5,"station did not unify primitive consist",pending final Mobile 4.5 gate
track tie,assets/sky_lagoon/lagoon_kit/lagoon_track_tie.glb,railway,240,1.5,"plain repeated BoxMesh sleeper",pending final Mobile 4.5 gate
train engine,assets/sky_lagoon/lagoon_kit/lagoon_train_engine.glb,railway,1,1.5,"runtime primitive blockout",pending final Mobile 4.5 gate
train tender,assets/sky_lagoon/lagoon_kit/lagoon_train_tender.glb,railway,1,1.5,"runtime box and coal spheres",pending final Mobile 4.5 gate
train coach,assets/sky_lagoon/lagoon_kit/lagoon_train_coach.glb,railway,1,1.5,"runtime box/post construction",pending final Mobile 4.5 gate
train gondola,assets/sky_lagoon/lagoon_kit/lagoon_train_gondola.glb,railway,1,1.5,"runtime box construction",pending final Mobile 4.5 gate
train caboose,assets/sky_lagoon/lagoon_kit/lagoon_train_caboose.glb,railway,1,1.5,"runtime box construction",pending final Mobile 4.5 gate
castle bridge,assets/sky_lagoon/lagoon_kit/lagoon_castle_bridge.glb,castle approach,1,2.5,"flat wood slab and dark rail boxes",pending final Mobile 4.5 gate
Pearl Castle shell,assets/sky_lagoon/lagoon_kit/lagoon_pearl_castle.glb,castle,1,2.8,"mixed procedural/stock construction weakened focal destination",pending final Mobile 4.5 gate
Alpine chalet A,assets/sky_lagoon/lagoon_kit/lagoon_alpine_chalet_a.glb,snow,1,2.0,"procedural shell with repeated roof structure",pending final Mobile 4.5 gate
Alpine chalet B,assets/sky_lagoon/lagoon_kit/lagoon_alpine_chalet_b.glb,snow,1,2.0,"palette variation of repeated shell",pending final Mobile 4.5 gate
Alpine chalet C,assets/sky_lagoon/lagoon_kit/lagoon_alpine_chalet_c.glb,snow,1,2.0,"palette variation of repeated shell",pending final Mobile 4.5 gate
Alpine cave shell,assets/sky_lagoon/lagoon_kit/lagoon_alpine_cave.glb,snow mountain,1,1.5,"near-black box alcove and boulders",pending final Mobile 4.5 gate
Alpine gifts,assets/sky_lagoon/lagoon_kit/lagoon_alpine_gifts.glb,snow,1,2.0,"plain runtime boxes",pending final Mobile 4.5 gate
Alpine snowman,assets/sky_lagoon/lagoon_kit/lagoon_alpine_snowman.glb,snow,1,2.0,"sphere stack and box hat",pending final Mobile 4.5 gate
Alpine cairn,assets/sky_lagoon/lagoon_kit/lagoon_alpine_cairn.glb,snow trail,4,2.0,"sphere stacks plus Label3D glint",pending final Mobile 4.5 gate
snowbank,assets/sky_lagoon/lagoon_kit/lagoon_snowbank.glb,snow edge,7,3.0,"existing family needed revised palette cohesion",pending final Mobile 4.5 gate
cloud A,assets/art35/landmarks/cloud_0.glb,sky,varies,3.0,"existing family needed revised kit palette",pending final Mobile 4.5 gate
cloud B,assets/art35/landmarks/cloud_1.glb,sky,varies,3.0,"existing family needed revised kit palette",pending final Mobile 4.5 gate
cloud C,assets/art35/landmarks/cloud_2.glb,sky,varies,3.0,"existing family needed revised kit palette",pending final Mobile 4.5 gate
